5100,9115,東証1部,明治海運(株),外航船船主。自動車船、タンカー、バラ積み船を中長期貸船。ホテル、不動産賃貸も。商船三井色
5100,9119,東証1部,飯野海運(株),ケミカル船、タンカー、ガス船、バラ積み船を運航。本社新ビルの賃貸が収益柱。土地含み大きい
5100,9127,東証2部,玉井商船(株),日軽金のアルミニウム原料船や全農向け穀物輸送主体。特殊船も。自社船運航主体。発祥は神戸
5100,9130,東証1部,共栄タンカー(株),日本郵船系の外航海運会社。タンカーの長期貸船主体。コスモ石油向け過半。バラ積み船増強
5100,9132,東証1部,第一中央汽船(株),商船三井系、新日鉄住金色。不定期外航船大手。鉄鋼関連などバラ積み船主力。経営再建中
5100,9133,東証JQS,(株)東栄リーファーライン,超冷凍運搬船によるマグロ専用運送が主体。機械、漁具、冷凍餌等貿易事業との２本柱経営
5100,9171,東証2部,栗林商船(株),内航大手。北海道と東京、大阪間が主航路で新聞用紙が主。外航、青函フェリーに加えホテルも
5100,9173,東証2部,東海汽船(株),伊豆七島の観光・生活航路を独占。大島でバス運行、ホテル経営。レストラン船、貨物運送も
5100,9176,東証JQS,佐渡汽船(株),新潟―佐渡島間でフェリー、ジェット船を３航路運航。新潟県と佐渡市、長岡市が計４割強出資
5100,9179,東証2部,川崎近海汽船(株),内航・フェリー６割弱。小型バラ積み船はアジア等近海輸送成長、遠洋進出。製鉄・製紙が主顧客
5100,9180,東証JQS,新和内航海運(株),旧新和海運（現ＮＳユナイテッド）の内航子会社。新日鉄住金向け鋼材、石灰石、セメントを輸送
5150,9201,東証1部,日本航空(株),国際線首位、国内線２位。公的資金投入と大リストラで更生法終結。豪カンタスと格安航空合弁
5150,9202,東証1部,ＡＮＡホールディングス(株),国内線首位、国際線２位。傘下にＬＣＣのバニラ・エアとピーチ。出資、Ｍ＆Ａに積極姿勢
5150,9204,マザーズ,スカイマーク(株),新興航空会社の旗頭、大手の半額程度で羽田等を拠点に国内線展開、１４年度に海外長距離線参入
5150,9206,東証2部,(株)スターフライヤー,北九州空港を拠点とする新興エアライン、ビジネス需要主体で割安、座席広めと独自戦略
5150,9232,東証1部,(株)パスコ,セコム傘下の航空測量最大手。公共測量依存からの脱却掲げ、衛星測量、海外事業拡大を企図
5150,9233,東証2部,アジア航測(株),航空測量３位。ＧＩＳ（地理情報システム）等の情報システムとコンサルが柱。官公需依存高い
5200,9058,東証1部,トランコム(株),物流センター受託、物流情報サービス（求貨求車）、生産請負が３本柱。東名阪軸に全国展開
5200,9066,東証1部,(株)日新,国際物流大手。自動車、電機に地盤。日・米・中・アジア・欧５極経営。旅行業併営。危険品物流参入
5200,9193,東証2部,東京汽船(株),東京湾全域に展開の曳船大手。国内２位。外国船に強い。フェリー、観光船も。香港に曳船合弁
5200,9301,東証1部,三菱倉庫(株),倉庫首位。施設の高度化推進。陸上、港湾、国際一貫輸送に注力。賃貸ビルの収益比重高い
5200,9302,東証1部,三井倉庫(株),倉庫大手。不動産賃貸が利益柱。総合物流強化へ海外で積極投資。三洋電機ロジを１２年４月買収
5200,9303,東証1部,(株)住友倉庫,倉庫大手で総合物流に展開、傘下に遠州トラック。不動産賃貸が下支え。土地含み大。海外強化
5200,9304,東証1部,澁澤倉庫(株),旧第一勧銀系の倉庫準大手。早くから陸運強化。保有土地活用し不動産業拡充。中国積極開拓
5200,9306,東証1部,東陽倉庫(株),中部圏地盤の有力倉庫。工業品から食品まで取り扱い多彩。不動産事業展開、劇団四季に賃貸
5200,9307,東証2部,(株)杉村倉庫,関西倉庫業の老舗、流通加工や運送も。不動産賃貸、ゴルフ練習場など併営。野村ＨＤグループ
5200,9308,東証2部,イヌイ倉庫(株),倉庫業と不動産業の２本柱経営。本拠の東京・勝どきで超高層賃貸マンション群など再開発推進
5200,9310,東証1部,日本トランスシティ(株),倉庫業界４位、中部地区最大。総合物流企業で海外に展開。四日市港で取扱品目の多様化を推進
5200,9311,東証2部,アサガミ(株),総合物流と印刷の双柱。婚礼案内状・年賀状印刷首位。読売、東京新聞の印刷も。利益年末集中
5200,9312,東証1部,ケイヒン(株),総合物流準大手。中古車輸出強い。通販流通センター受託も。米国大手ＢＤＰと連携し海外強化
5200,9313,東証2部,丸八倉庫(株),首都圏中心に仙台にも倉庫持つ。文書保管を拡大。東京、仙台等で不動産事業強化し第２の柱に
5200,9317,東証2部,(株)オーナミ,日立造船グループ。倉庫、荷役、運輸、梱包を併営。重量物得意。上海現法を設け国際物流育成
5200,9319,東証1部,(株)中央倉庫,内陸の総合物流でトップクラス。倉庫上位の安田倉庫と連携、補完し合い国際貨物拡大に注力
5200,9320,東証2部,三和倉庫(株),日本曹達直系の中堅倉庫。化学品物流を一括受託、危険品に強み。医薬品に注力。自己資本厚い
5200,9322,東証2部,川西倉庫(株),業界中堅上位。普通倉庫、冷蔵倉庫兼営。自社のネットワーク、ＩＴ強化で総合物流企業志向
5200,9324,東証1部,安田倉庫(株),旧財閥系の倉庫準大手。外資系の取り扱い多い。首都圏軸に事業展開し関西強い中央倉庫と提携
5200,9351,東証1部,東洋埠頭(株),最大手の埠頭会社で特殊倉庫のパイオニア。青果物など農産品の扱いを強化。国際物流に注力
5200,9353,東証2部,櫻島埠頭(株),大阪唯一の商業埠頭会社。バラ貨物が主体。液体タンク群誇る。冷蔵・低温倉庫なども展開
5200,9355,東証2部,(株)リンコーコーポレーション,新潟港軸の港湾運送大手。倉庫や運輸、商品販売、ホテル、不動産なども展開。川崎汽船系列
5200,9357,名証2部,名港海運(株),名古屋港拠点の港運業者大手。海陸空一貫輸送体制を整備。米欧アジア等に現地拠点持つ
5200,9358,東証1部,(株)宇徳,港湾運輸大手。重量品輸送得意。プラントも。同じ商船三井系の国際コンテナと１１年４月合併
5200,9359,名証2部,伊勢湾海運(株),名古屋港湾運送大手。陸海空一貫体制整え海外強化。廃棄物リサイクル等も展開。自己資本厚い
5200,9360,東証2部,鈴与シンワート(株),鈴与グループ。物流、情報サービスが２本柱。小麦粉、セメントに強み。ＮＴＴデータが上位株主
5200,9361,東証2部,伏木海陸運送(株),伏木港、富山新港等で紙製品やコンテナの港湾作業が中心。日ロ定期船も運航。客船クルーズも
5200,9362,東証2部,兵機海運(株),姫路、水島、神戸、大阪での鋼材一貫輸送に強み。中露韓へ外航海運も。本社に巨大物流センター
5200,9363,東証2部,(株)大運,阪神港地盤の港湾運送業者。パナソニック系と大日本スクリーンが大口荷主。名古屋でも開拓中
5200,9364,東証1部,(株)上組,港湾総合運送で首位級。設備投資積極的。ビル賃貸等に頼らず高品質物流特化で差別化。無借金
5200,9365,東証2部,トレーディア(株),神戸地盤で５大港での港湾運送が主軸。中国や東南ア中心に国際複合一貫輸送の拡充に注力
5200,9366,東証1部,(株)サンリツ,工作機械、半導体、精密機器など輸出用梱包に強み。輸送、保管も。中国で梱包資材販売会社育成
5200,9367,東証JQS,大東港運(株),畜産物輸入冷凍食品を軸に輸入貨物の取扱比率８割。国内の鋼材運送、荷役も。外注比率が高い
5200,9368,東証1部,キムラユニティー(株),愛知県地盤。トヨタの部品包装が主力。カーリース、車両整備なども。中国での事業基盤拡大中
5200,9369,東証1部,(株)キユーソー流通システム,食品物流最大手。キユーピー系だが依存度１割台。チルド、冷凍品に強み。全国で小口輸配送も
5200,9370,東証1部,郵船ロジスティクス(株),日本郵船傘下の再編で航空混載（フォワーダー）から総合化。海外比率約８割。ヤマトＨＤと提携
5200,9375,東証1部,(株)近鉄エクスプレス,国際航空貨物混載で国内２位。国際網充実、中国で先行。商船三井と提携。近鉄の持分対象会社
5200,9377,東証JQS,(株)エージーピー,駐機中の航空機向けに電力供給。幹線空港で固定式電源でほぼ独占。ＩＨカート事業を育成中
5200,9380,東証1部,東海運(株),太平洋セメント系。アジア船ターミナル業務が主柱。ロシアへの国際輸送が強み。環境関連育成
5200,9381,東証1部,(株)エーアイテイー,関西発祥の複合一貫輸送業者。日中間の海上輸送で衣料、日用雑貨等輸入に強み。通関業務注力
5200,9384,東証2部,内外トランスライン(株),独立系の国際海上輸出混載首位。アジアはじめ豊富な仕向け地と運航頻度が強み。自己資本厚い
5200,9386,東証JQS,日本コンセプト(株),タンクコンテナを用いた化学品、薬品、食品材料など液体物流サービスを提供。輸送自体は外注
5250,1973,東証1部,ＮＥＣネッツエスアイ(株),ＮＥＣの工事部門が独立。一般企業・通信会社向けにシステム構築やクラウド提供。通信工事も
5250,2138,東証JQS,クルーズ(株),１０年４月参入したソーシャルゲームが収益源、「モバゲー」向け主体。ｅコマースを育成中
5250,2303,東証JQS,(株)ドーン,地理情報システム（ＧＩＳ）構築ソフト「ジオベース」をリソースとしたソフト受託開発が主力
5250,2307,東証JQS,(株)クロスキャット,ソフトウエア開発中心の中堅ＳＩ。クレジット向けシステムに強み。コンサル事業を強化中
5250,2315,東証JQS,(株)ＳＪＩ,中国留学生が創業のＳＩ。日中で事業展開。大株主に神州数碼。１２年に中国ＳＩサイノコム買収
5250,2317,東証1部,(株)システナ,モバイル端末向けソフトの開発支援など展開。システム運用・保守も。１０年４月にカテナと合併
5250,2321,東証JQG,(株)ソフトフロント,ＳＩＰ（ＩＰ電話やビデオ会議を実現する技術）のソフトウエア開発手掛けるＩＴベンチャー
5250,2323,東証JQS,(株)ｆｏｎｆｕｎ,携帯電話でＰＣメール利用可能なリモートメールが柱。１１年に旧経営陣の不正発覚し再生途上
5250,2326,東証1部,デジタルアーツ(株),ネットの有害情報遮断、情報漏洩防止フィルタリングソフト国内最大手。他業種との連携推進
5250,2327,東証1部,新日鉄住金ソリューションズ(株),システム構築専業。１２年社名変更。新日鉄住金系だが依存度低い。データセンター事業に注力
5250,2329,東証JQS,(株)東北新社,ＣＭ制作や外国映画の日本語版制作で首位。衛星放送のチャンネル運営、映画の制作・配給も
5250,2330,東証JQS,(株)ＳｍａｒｔＥｂｏｏｋ．ｃｏｍ,出発は携帯コンテンツ配信。買収戦略裏目で電子書籍関連に集中。旧フォーサイド・ドット・コム
5250,2332,東証JQS,(株)クエスト,ソフト開発とシステム運用が両輪。半導体、製造、金融に強い。中国・大連でオフショア開発
5250,2335,東証2部,(株)キューブシステム,銀行向け、流通向けなどのシステム開発が主業。プロジェクト管理能力に定評。研修制度充実
5250,2338,マザーズ,(株)ファステップス,携帯電話ネット技術のシステム構築。広告代理子会社の売上比率高い。７シーズグループ離脱
5250,2345,マザーズ,(株)システム・テクノロジー・アイ,ＩＴ技術者学習支援ソフトなどｅラーニングが主力。オラクルＤＢ認定研修も。ＳＥＨＩ傘下
5250,2349,東証JQS,(株)エヌアイデイ,独立系ＳＩ。組み込みソフト開発、システム開発、ネット運用が３本柱。コンテンツ分野開拓中
5250,2351,マザーズ,(株)ＡＳＪ,サーバーホスティング業界中堅。ネット予約・決済、ブラウザ野球ゲーム等進出。Ｍ＆Ａ注力
5250,2352,マザーズ,(株)エイジア,ネット、メール利用した販売支援パッケージソフトの開発・販売が柱。ＥＣ関連事業へ進出計画
5250,2354,東証2部,安川情報システム(株),安川電機の情報処理子会社。システム構築と組み込みソフト受託開発。医療など新領域へも展開
5250,2359,東証1部,(株)コア,携帯電話や情報家電向け組み込みソフトが主力。金融向けシステムも強い。電子テロップも
5250,2411,東証JQS,ゲンダイエージェンシー(株),パチンコ店向け広告会社。チラシ、ＤＭ、装飾用ポスター等企画制作。中古遊技機売買仲介は撤退
5250,2484,東証JQS,夢の街創造委員会(株),出前フード仲介サイト「出前館」を運営。子会社で飲食店向け食材通販を展開。韓国にも進出
5250,2665,東証2部,三井情報(株),三井物産系。システム開発と通信インフラ構築に実績。エネ管理など新事業と海外展開を加速中
5250,2799,東証JQS,(株)パイオン,光通信子会社。大阪地盤の携帯販売代理店。ａｕ、ソフトバンク主体。法人向け携帯販売は撤退
5250,3040,東証JQS,(株)ソリトンシステムズ,セキュリティ対策ソフトとシステム構築が柱。映像伝送や人感センサーなど育成。技術力定評
5250,3371,東証1部,(株)ソフトクリエイトホールディングス,ｅコマースサイト構築エンジン「ｅｃｂｅｉｎｇ」の提供から、ＳＩ・ＰＣ販売まで幅広く展開
5250,3622,マザーズ,ネットイヤーグループ(株),ネット活用したマーケティング支援行う。経営コンサル、Ｗｅｂサイト制作まで総合的に提供
5250,3623,マザーズ,ビリングシステム(株),インターネットの決済サービス手掛け、収納代行、クイック入金が２本柱。スマホ決済事業育成
5250,3624,マザーズ,アクセルマーク(株),セプテーニ傘下。ソーシャルゲームと広告支援主力。現社長は１１年１０月合併したエフルート出身
5250,3625,東証JQG,テックファーム(株),独立系ソフトハウス。「Ｇガイドモバイル」等携帯電話向け開発に強い。読売新聞社と資本提携
5250,3626,東証1部,ＩＴホールディングス(株),独立系ＳＩ大手。クレジットカードなど金融向けが主。ＴＩＳ、インテックなど傘下に約４０社
5250,3627,東証1部,ネオス(株),携帯向けに電子書籍、待ち受け画面コンテンツ等やアプリ、法人向けＷｅｂ支援事業を展開
5250,3628,マザーズ,(株)データホライゾン,保険者向けのジェネリック医薬品通知サービスが柱。加入者の健康推進目的の保健事業支援も
5250,3630,東証1部,(株)電算システム,情報処理サービス開発中堅。払込票決済など収納代行を拡大中。グーグルの販売代理店展開も
5250,3632,東証1部,グリー(株),携帯向けゲーム「ＧＲＥＥ」運営。ゲームを通じたアイテム課金収益源。戦線拡大路線見直し中
5250,3633,東証JQS,(株)ｐａｐｅｒｂｏｙ＆ｃｏ．,個人向けレンタルサーバーサービスが主、ネット店舗構築・販売支援を強化中。ＧＭＯの子会社
5250,3634,マザーズ,(株)ソケッツ,携帯や動画配信サービス向けに、音楽・書籍データのジャンル別検索機能を提供。ａｕ向け主力
5250,3635,東証1部,コーエーテクモホールディングス(株),ゲームソフト中堅のコーエーとテクモが０９年経営統合。オンラインゲーム含め海外展開強化へ
5250,3636,東証1部,(株)三菱総合研究所,コンサルとＩＴシステムの２本柱。コンサルでは理系の研究者多数抱える。官公庁や金融に強み
5250,3639,東証1部,(株)ボルテージ,恋愛シミュレーションゲーム先駆。携帯公式サイト向けやスマホ向けに配信。顧客は女性に特化
5250,3640,東証1部,(株)電算,信越地盤の情報処理・システム開発中堅。首都圏へも展開。市役所など地方自治体向けに強み
5250,3641,東証JQS,(株)パピレス,９５年富士通の社外ベンチャーとして出発。電子書籍販売、配信の先駆者。０７年から電子貸本展開
5250,3645,マザーズ,日本メディカルネットコミュニケーションズ,インプラント、矯正など自由診療歯科向けのポータルサイト運営。広告収益主体だが課金育成中
5250,3646,マザーズ,(株)駅探,経路検索サービス「駅探」運営。モバイル経由の個人課金、法人向けライセンス販売、広告を展開
5250,3647,マザーズ,(株)コネクトホールディングス,傘下にギャル向け雑貨のＳＢＹ。ソフト開発が母体だったが、赤字続きで１２年秋に事業譲渡
5250,3648,東証2部,ＡＧＳ(株),りそな銀系の情報システム会社。データセンター運用、ソフト開発が柱。りそな向け年商の３割
5250,3649,東証JQS,(株)ピーエスシー,愛媛本拠の医療システム会社。病院、診療所向け医療用データ管理システム「クライオ」が主力
5250,3652,マザーズ,(株)ディジタルメディアプロフェッショナル,研究開発型ファブレス半導体企業。描画向け回路設計の使用許諾が主。任天堂ゲーム機向け大
5250,3653,マザーズ,(株)モルフォ,携帯電話用の画像処理ソフト開発のベンチャー。ドコモと資本提携。デジカメなどへ領域拡大
5250,3654,東証1部,(株)ヒト・コミュニケーションズ,光回線や携帯、家電など営業支援。業務請負が主で人材派遣も。観光など情報通信関連も強化
5250,3655,東証1部,(株)ブレインパッド,企業データを分析し販促に活用するデータマイニング提供に強み。関連ソフト開発や販売も
5250,3656,東証1部,ＫＬａｂ(株),受託開発で出発。０９年参入のソーシャルゲームが主力。アップル等へのスマホ向け配信に重点
5250,3657,東証1部,ポールトゥウィン・ピットクルーＨＤ(株),傘下にデバッグ・検証のポールトゥウィン、ネット看視のピットクルー。欧米、中・印に拠点
5250,3658,東証1部,(株)イーブックイニシアティブジャパン,小学館出身の鈴木会長が創業。運営サイトにおける電子書籍配信が柱。漫画の作品数は業界随一
5250,3659,東証1部,(株)ネクソン,韓国発祥、ＰＣ向けオンラインゲーム先駆、００年日本進出。中国、韓国経由の売り上げが過半
5250,3660,東証1部,(株)アイスタイル,２０〜３０代女性向け化粧品の口コミサイト「アットコスメ」運営、広告販売主力。通販、店舗運営も
5250,3661,東証1部,(株)エムアップ,社長がレコード会社出身のＩＴベンチャー。芸能人のファンサイト運営が柱。ＣＤなど物販も
5250,3662,東証1部,(株)エイチーム,従来型携帯電話向け公式サイトの運営で成長。現在はスマホゲームと比較情報サイト運営が柱
5250,3663,東証2部,アートスパークホールディングス(株),セルシスとエイチアイが統合。携帯向けの電子コミック閲覧や３Ｄ動画向けソフトなど展開
5250,3664,マザーズ,(株)モブキャスト,スポーツ特化型ＳＮＳ「モブキャスト」通じたソーシャルゲーム主力。スポーツ予想、実況も
5250,3665,マザーズ,(株)エニグモ,服飾中心のソーシャル通販サイト「バイマ」運営。売り手、買い手双方からの手数料が利益源
5250,3666,東証JQS,(株)テクノスジャパン,ＳＡＰ中心にＥＲＰソフトを導入支援。業種テンプレートに強み。上流コンサルと海外展開志向
5250,3667,マザーズ,(株)ｅｎｉｓｈ,ソーシャルアプリの企画・開発・運営会社。経営シミュレーションゲームが柱。女性向けに強い
5250,3668,マザーズ,(株)コロプラ,位置情報ゲームから出発。１１年９月スマホ専用ゲーム配信参入し急成長。リアル店舗との連携も
5250,3669,マザーズ,モバイルクリエイト(株),タクシーやバス向けに車両などの移動体管理システム提供。九州地盤だが関西や首都圏進出
5250,3670,東証JQS,協立情報通信(株),ＯＢＣのＥＲＰソフト中堅代理店。システム構築に実績。電話交換機設置やドコモ販売店経営も
5250,3671,マザーズ,ソフトマックス(株),Ｗｅｂ型電子カルテを主力とした総合医療情報システムを開発。九州地盤、東日本を重点開拓
5250,3672,マザーズ,(株)オルトプラス,グリー向けソーシャルゲーム主力。開発は独自作品に加え他社と共同も展開。配当性向２０％方針
5250,3673,東証1部,(株)ブロードリーフ,整備、部品商など自動車アフター市場向け業務アプリで高シェア。部品流通ネットワーク運営
5250,3674,マザーズ,(株)オークファン,ネットオークション等の情報・価格検索や分析サービス行うサイト運営。膨大な蓄積データ武器
5250,3675,マザーズ,(株)クロス・マーケティンググループ,ネット市場調査核にマーケティング領域で事業展開。調査は２位級。中国に拠点。純粋持株会社
5250,3676,東証1部,(株)ハーツユナイテッドグループ,""
5250,3677,東証JQS,(株)システム情報,""
5250,3710,東証JQS,ジョルダン(株),目的地までの経路探索ソフト「乗換案内」の開発販売が主軸。旅行販売や動画配信事業も展開
5250,3711,東証JQS,(株)創通,アニメ番組の企画・制作と版権が２本柱。「ガンダム」が収益基盤。プロ球団の版権契約代行も
5250,3712,マザーズ,(株)情報企画,信金など金融機関対象の業務支援パッケージを開発、販売。事業会社向けにも進出意欲が強い
5250,3715,東証1部,(株)ドワンゴ,動画投稿共有サイト「ニコニコ動画」軸に成長。携帯向け音楽配信、家庭用ゲーム、ライブ施設も
5250,3719,東証JQS,(株)ジェクシード,人事・会計に特化したＥＲＰコンサル企業。投資事業撤退し本業回帰で再建中。教育事業に注力
5250,3723,マザーズ,日本ファルコム(株),プレステ用ゲームソフトの企画・開発主力、ロールプレイング系得意。アプリ等のライセンスも
5250,3724,東証1部,(株)ベリサーブ,ＳＣＳＫグループ。携帯、デジタル家電、高度道路交通システム（ＩＴＳ）のソフト検証で先駆的
5250,3727,マザーズ,アプリックスＩＰホールディングス(株),Ｊａｖａ技術使った携帯向け組み込みソフトを開発。ゲーム等コンテンツ事業参入。海外強化
5250,3730,東証1部,(株)マクロミル,インターネットを利用した調査会社で首位。機械化で短期間、低価格に強み、ヤフーと友好的
5250,3731,マザーズ,(株)京王ズホールディングス,東北地盤の携帯販売中堅。保険販売も。ゲーム、介護に進出。不祥事発覚し特設注意市場銘柄に
5250,3733,東証JQS,(株)ソフトウェア・サービス,病院向け電子カルテなど医療情報システムを開発。ハードウエアの販売から保守サービスも
5250,3734,マザーズ,(株)インテア・ホールディングス,創業のＩＴインフラ事業から完全撤退。スマートインフラ事業、コンテンツ配信事業に戦略転換
5250,3738,東証1部,(株)ティーガイア,携帯販売代理店最大手。０８年に大手２社が合併。光回線販売や決済サービスも。中国市場強化
5250,3739,名古屋セ,コムシード(株),パチンコ関連の携帯電話コンテンツなどモバイル事業に特化。オンラインゲームからは撤退
5250,3741,東証JQS,(株)セック,リアルタイムソフトウエア技術に強み。携帯電話組み込みソフトが柱。ロボット技術の開発も
5250,3742,マザーズ,ＩＴｂｏｏｋ(株),官公庁向け主体のＩＴコンサル。業務最適化・情報システム効率化を戦略提案。収益は下期偏重
