0050,1301,東証1部,(株)極洋,水産品の貿易、加工、買い付け主力。すしネタに強み。加工食品は業務用が軸。海外加工比率高い
0050,1332,東証1部,日本水産(株),水産品冷食の大手。魚油成分使用した化成品が利益柱。Ｍ＆Ａ駆使し世界的ＳＣＭ構築目指す
0050,1334,東証1部,(株)マルハニチロホールディングス,水産最大手、国内に強固な流通網。三国間取引推進。国内外でのマグロ、エビ養殖が新機軸
0050,1376,東証JQS,カネコ種苗(株),野菜・牧草種子など種苗事業や農薬が収益柱。農業資材や花きも販売。利益は下期の比重高い
0050,1377,東証1部,(株)サカタのタネ,種苗首位級。アンデスメロン等の自社開発品多彩。ブロッコリー世界シェア６割と海外展開先行
0050,1378,東証2部,(株)雪国まいたけ,マイタケでシェア過半、ブナシメジ、カット野菜も。大平一族色。国内は新潟集中。中国で合弁
0050,1379,東証1部,ホクト(株),ブナシメジ、エリンギで首位。地盤の長野中心に全国で生産拠点展開。米国、台湾でも生産
0050,1380,東証JQS,(株)秋川牧園,無農薬無投薬の食肉、鶏卵、牛乳等を製造販売。生協向けが主。直販宅配「スマイル生活」を強化
0050,1381,東証JQS,(株)アクシーズ,鶏肉国内大手。ケンタッキー（ＫＦＣ）と食肉卸向け柱。飼料製造から加工まで一貫。外食ＦＣも
0050,1382,東証JQS,(株)ホーブ,イチゴ果実を大手洋菓子メーカーや菓子・パン業者に販売、夏秋は自社品中心、冬は仕入れ品
0050,1383,東証JQS,ベルグアース(株),接ぎ木したトマト、キュウリなど野菜苗を生産販売。病害虫、連作障害に強い苗開発が強み
1050,1514,東証1部,住石ホールディングス(株),住友石炭鉱業が母体。国内炭撤退、豪州等からの輸入炭にシフト。人工ダイヤ、採石等にも展開
1050,1515,東証1部,日鉄鉱業(株),新日鉄住金系。石灰石、銅精鉱、電気銅主力。機械、環境、不動産も。チリ銅鉱山など海外採鉱拡大
1050,1518,東証1部,三井松島産業(株),豪州で石炭開発し輸入販売。豪以外でも権益拡大。建機材、施設運営、金属再生、太陽光発電も
1050,1605,東証1部,国際石油開発帝石(株),原油・ガス開発生産の国内最大手。政府が黄金株保有。豪ＬＮＧ開発案件イクシスに２兆円投資
1050,1606,東証1部,日本海洋掘削(株),海洋掘削の専業。原油・天然ガス田の試掘や生産井掘削を受託。東南ア、中東等で掘削リグ操業
1050,1661,東証1部,関東天然瓦斯開発(株),千葉で天然ガス、ヨード生産。大多喜ガスと統合へ。１２月２６日上場廃止、共同持株会社１月上場
1050,1662,東証1部,石油資源開発(株),原油・ガス開発専業。新潟、秋田等での天然ガス田操業が大黒柱。カナダで超重質油の生産も
2050,1400,東証JQG,ルーデン・ホールディングス(株),マンション室内コーティング主力。ビル管理やマンション区分所有物件軸に不動産事業も展開
2050,1401,福岡Q,(株)エムビーエス,独自研磨法と特殊コーティング剤での外装リフォーム会社。直接施工と並行し契約工務店拡大
2050,1405,東証2部,サーラ住宅(株),愛知、静岡地盤のサーラグループ中核。高気密高断熱住宅に特徴。宅地開発、マンション分譲も
2050,1407,東証JQS,(株)ウエストホールディングス,住宅リフォームから太陽光発電工事に重点移行、全国展開。提携に積極的。太陽光分野を深耕
2050,1408,東証JQG,サムシングホールディングス(株),戸建てや商業用地を対象にした地盤改良工事および地盤保証事業を展開。ベトナムへも進出
2050,1413,名証2部,(株)桧家ホールディングス,エコハウス中心に規格型注文住宅の請負・施工。東京周辺で分譲住宅。断熱材生産でも急成長中
2050,1414,東証1部,ショーボンドホールディングス(株),橋梁、ビルなどコンクリート構造物補修の先駆けで最大手。補修材料販売も。研究所持ち高技術
2050,1417,東証1部,(株)ミライト・ホールディングス,通信工事で３位。業界中堅の大明、コミューチュア、東電通が１０年に経営統合。ＮＴＴ向け主体
2050,1418,東証JQS,インターライフホールディングス(株),内装工事の日商インター等を傘下に持つ持株会社。携帯販売、人材派遣、広告代理業等へ展開
2050,1419,東証1部,タマホーム(株),注文住宅会社。ロードサイド型独立店を積極展開し大々的な広告で集客。分譲など周辺にも展開
2050,1420,東証2部,サンヨーホームズ(株),戸建て住宅、マンション、賃貸福祉住宅の設計・販売が主。近畿圏中心に首都圏、中部圏等で展開
2050,1711,マザーズ,(株)省電舎,日本でのエスコ事業（エネルギー削減保証ビジネス）の草分け。再生可能エネルギー事業を育成
2050,1712,東証1部,(株)ダイセキ環境ソリューション,汚染土壌の調査から浄化処理までの一貫体制に特徴。名古屋地盤だが、関東、関西でも展開拡大
2050,1716,東証JQS,第一カッター興業(株),ダイヤモンド使用のコンクリート構造物切断、穿孔工事が主力。水圧のウォータージェットも
2050,1717,東証JQS,明豊ファシリティワークス(株),オフィス移転・新設や、建築工事を補助・代行するＣＭ（コンストラクションマネジメント）主力
2050,1718,東証JQS,美樹工業(株),大阪ガス軸のガス工事、子会社のセキスイハイム販売など住宅、建設が柱。不動産賃貸を育成
2050,1719,東証1部,安藤ハザマ,ダム、トンネル等大型土木に定評ある名門。１３年４月、民間建築が主力の安藤建設を吸収合併
2050,1720,東証1部,東急建設(株),東急グループ関連からの受注約２割。渋谷駅前開発案件を継続的に受注。単独配当性向３割メド
2050,1721,東証1部,コムシスホールディングス(株),電気通信工事で最大手。ネットワーク構築に強み。日本コムシスが三和エレック等を統合
2050,1722,東証1部,ミサワホーム(株),住宅大手。トヨタホームが筆頭株主。事業内容は住宅、リフォームに特化。多角化が今後の課題
2050,1723,東証JQS,日本電技(株),ビル空調計装工事の大手。工場搬送ライン用などの自動制御システムも展開。アズビルと提携
2050,1724,東証JQS,シンクレイヤ(株),ケーブルテレビ事業者向けにシステム構築。運用、保守を行う。光関連など機器販売も拡充
2050,1726,東証2部,(株)ビーアールホールディングス,極東興和が中核。中国、関西地盤のＰＣ橋梁中堅。Ｍ＆Ａで関東、東北へエリア拡大し全国化
2050,1728,東証JQS,ミサワホーム中国(株),ミサワホームの中国地方全域を担当。店舗など非住宅分野へも展開。エコリフォームに積極的
2050,1730,東証JQS,麻生フオームクリート(株),麻生グループ。地盤改良、軽量盛土など気泡コンクリート工事の最大手。中国で合弁会社も展開
2050,1734,札証,(株)北弘電社,屋内配線工事では道内トップ。ＦＡ機器の販売を併営。自社に設備設置し太陽光発電事業参入
2050,1736,東証JQS,(株)オーテック,工場・ビル空調自動制御設備の建設、施工、メンテなどが柱。建築設備資材や機器販売も展開
2050,1737,東証2部,三井金属エンジニアリング(株),プラント中堅。非鉄製錬に特化し特に銅製錬に強み。複合ポリエチレンパイプ製販事業を併営
2050,1738,名証2部,(株)ＮＩＴＴＯＨ,白アリ等の防虫駆除と住宅請負工事が柱。ビルメンテも推進。愛知地盤だが関東、関西にも進出
2050,1739,東証JQG,(株)ＳＥＥＤ,京都、滋賀地盤の建設会社。賃貸マンション建築が収益柱。三栄建築設計傘下で経営再建中
2050,1743,東証2部,コーアツ工業(株),橋梁工事中心の中堅。官公需８割。九州地盤。プレストレストコンクリ技術に定評。健食通販も
2050,1757,東証2部,クレアホールディングス(株),旧キーイングホーム、社名変更頻繁。住宅リフォーム、給排水管が基盤。太陽光事業参入。再建中
2050,1758,東証JQS,太洋基礎工業(株),地中連続壁など特殊土木工事（官公需）と積水ハウスの住宅地盤改良工事が２本柱。全国展開
2050,1762,東証1部,(株)高松コンストラクショングループ,関西地盤に全国展開する中堅ゼネコン。傘下に青木あすなろ建設とみらい建設。利益率重視
2050,1764,東証2部,工藤建設(株),神奈川地盤の中堅建設。東京・練馬に拠点。不動産に続き介護（老人ホーム）を第３の柱に育成中
2050,1766,東証1部,東建コーポレーション(株),地主に賃貸住宅経営提案し施工から管理、仲介まで一貫化。住宅設備子会社を傘下に持つ
2050,1768,東証2部,(株)ソネック,兵庫県（東播磨）を地盤とする民間建築中心の中堅ゼネコン。子会社で化学運輸事業。無借金
2050,1770,東証JQS,藤田エンジニアリング(株),群馬県が地盤の設備工事中堅。空調・産業設備の保守に強み。情報システムや電子部品製造も
2050,1771,福証,日本乾溜工業(株),交通安全施設工事が主軸。福岡に重点。防災安全用品や竹繊維入り自然土固化舗装材にも注力
2050,1773,東証外国,ＹＴＬ,""
2050,1775,東証2部,富士古河Ｅ＆Ｃ(株),富士電機と古河グループの工事会社が合併で再出発。プラント、空調、建築付帯が主。海外注力
2050,1776,東証2部,三井住建道路(株),道路中堅。三井住友Ｇ関連工事が強み。完工高の官庁比率は５割以下がメド。有利子負債ゼロ
2050,1777,名証2部,川崎設備工業(株),０８年４月から電気設備の関電工傘下。空調・給排水等の設備工事中堅。リニューアル部門育成
2050,1780,東証1部,(株)ヤマウラ,長野県内の建築、土木中心。民間の比率高い。圧力容器や環境保全機器の製作も。多角化転換
2050,1782,東証JQS,常磐開発(株),常磐興産グループの総合建設。地元自治体とグループ依存から民間建築主力に。環境事業を育成
2050,1783,東証JQS,(株)Ａ．Ｃホールディングス,土木会社からスタートし業態転換。北海道、広島県等でのゴルフ場運営、建設関連軸に再建中
2050,1787,東証JQS,(株)ナカボーテック,鉄鋼構造物などの腐食を抑える防食専業のエンジニアリング。業界首位。ＲＣ等新規事業育成
2050,1788,東証JQS,(株)三東工業社,売上高の８割強が滋賀県内。官公需中心の土木から民間建築に軸足を移行中。不動産にも進出
2050,1789,東証JQS,山加電業(株),送電線、内線工事が主体だが、通信向けも育成。電力は東北電力が主要発注先。建物管理事業も
2050,1793,東証JQS,(株)大本組,土木主体中堅から建築主体にシフト。岡山を地盤に全国展開。無人化施工技術など独自技術強み
2050,1795,東証JQS,(株)マサル,ビル、マンション等のシーリング（外壁防水）工事でトップ。リニューアル（補修・改修）を強化
2050,1798,東証JQS,(株)守谷商会,長野地盤の中堅建設。首都圏、中部圏でも営業。トヨタホームと提携してプレハブ住宅を販売
2050,1799,東証JQS,第一建設工業(株),ＪＲ東日本系。線路工事など同社依存度約６割。非鉄道も強化。関東、信越、東北地盤。好財務
2050,1801,東証1部,大成建設(株),業界最大手の一角。非同族。道路事業を完全子会社化。不動産縮小。海外は建築軸に立て直し
2050,1802,東証1部,(株)大林組,業界最大手の一角。関西、首都圏で都市開発に積極的。海外は北米、アジア進出。不動産事業強化
2050,1803,東証1部,清水建設(株),業界最大手の一角。首都圏、民間建築が主力。環境エネルギーに注力。海外受注比率は１割未満
2050,1805,東証1部,飛島建設(株),土木主体の老舗。防災関連に強み、「トグル制震構法」で耐震補強に定評。財務体質改善が課題
2050,1807,東証JQS,(株)佐藤渡辺,旧渡辺組と旧佐藤道路が合併、道路舗装工事の中堅。東亜道路工業と技術情報の交換など実施
2050,1808,東証1部,(株)長谷工コーポレーション,マンション建築首位。土地手当て、計画立案から施工まで一貫モデル構築。サービス事業育成
2050,1810,東証1部,松井建設(株),１５８６年創業、社寺建築で優れた技術持つ。マンション等民間建築中心。受注計画は非公表
2050,1811,東証1部,(株)錢高組,関西本拠の老舗中堅ゼネコン。官民比率は４対６、マンション比率約２割。シールド工法に強み
2050,1812,東証1部,鹿島,業界最大手の一角。同族色。超高層、耐震、原発技術に強み。内外の不動産開発が収益下支え
2050,1813,東証1部,(株)不動テトラ,不動建設の土木部門とテトラが合併。海上土木得意、地盤改良と２本柱。日特建設に２割強出資
2050,1814,東証1部,大末建設(株),マンションなど民間建築が主体。関西主力だが首都圏のウエート高まる。大東建託と業務提携
2050,1815,東証1部,鉄建,鉄道、道路、マンション建設に強い。受注はＪＲ、官公庁、民間がバランス。鹿島と株持ち合い
2050,1819,東証1部,日鉄住金テックスエンジ(株),新日鉄住金系の総合エンジニアリング。作業請負と設備設計・施工が柱。日鉄エレックスを合併
2050,1820,東証1部,西松建設(株),ダム、トンネル等土木得意。戸田建設と技術提携。東南アジア深耕で海外売上比率２０％を目指す
2050,1821,東証1部,三井住友建設(株),大和証券Ｇ系ファンド下で再建ほぼ完了。ＰＣ橋と超高層マンションが強み。海外事業を強化中
2050,1822,東証1部,大豊建設(株),泥土加圧シールド、無人ケーソンの両工法で大型土木プロジェクトに参画。建築強化。堅実経営
2050,1824,東証1部,前田建設工業(株),土木主体から民間大型建築に積極展開。香港に地盤。本社再開発に着手。東洋建設と連携強化
2050,1826,東証1部,佐田建設(株),群馬・埼玉県が地盤の中堅建設会社。０４年から不動産分離、建設再構築、地域密着営業に重点
2050,1827,東証1部,(株)ナカノフドー建設,医療、物流など多彩な民間建築が主体の中堅ゼネコン。東南アジアでの高層住宅、工場等に実績
2050,1828,東証2部,田辺工業(株),化学プラントを主体とする中堅総合プラント工事会社。関東、中部が地盤。タイで表面処理事業
2050,1832,札証,北海電気工事(株),北海道電力傘下の電気工事会社。売り上げの約７割は北電向け。太陽光・風力発電用工事に注力
2050,1833,東証1部,(株)奥村組,関西系中堅ゼネコン。免震技術やトンネル施工技術に定評。堅実経営を標榜。ドーケンと提携
2050,1834,東証1部,大和小田急建設(株),大和ハウス工業傘下で協業推進。小田急グループとも密接で鉄道工事が得意。受注計画は非公表
2050,1835,東証1部,東鉄工業(株),軌道や駅舎等ＪＲ東日本関連が大半。屋上、駅舎緑化等環境事業にも注力。個人向けＩＲ重視
2050,1840,東証2部,(株)土屋ホールディングス,北海道地盤の住宅会社。在来工法首位。道内売り上げ７割。気密、断熱に優れた住宅を開発
2050,1841,東証JQS,サンユー建設(株),建築で創業し現在は不動産（分譲マンション、宅地販売）の２本柱。金属製品の加工事業も
2050,1844,東証2部,(株)大盛工業,上下水道・地中工事に特化した土木会社。葛飾、足立など都の関連が９割。再建中。大株主不安定
2050,1846,東証2部,鈴縫工業(株),日立、水戸など茨城県下を主力地盤に、建築・土木工事施工の総合建設。子会社で居宅介護展開
2050,1847,東証1部,(株)イチケン,ダイエー系からマルハン（パチンコホール、年商２兆円超）系へ。商業施設の建設・内改装が主力
2050,1848,東証2部,(株)富士ピー・エス,ＰＣ工法大手で橋梁など土木工事が主力。官公庁向けが大半。九州から全国化、枕木分野を強化
2050,1850,東証2部,南海辰村建設(株),近畿地盤の南海建設と、首都圏地盤の辰村組が統合して誕生した南海電鉄グループの中堅建設
2050,1852,東証1部,(株)淺沼組,１８９２年創業の関西系中堅ゼネコン。学校や官公庁建築に実績を持つ。関西を地盤に全国展開
2050,1853,東証2部,(株)森組,土木から建築主体に。筆頭株主が阪急電鉄から業務提携の長谷工コーポへ。阪急と協力関係続く
2050,1860,東証1部,戸田建設(株),準大手ゼネコン。病院、学校に強い建築の名門。三菱系顧客多い。堅実経営。コア事業強化推進
2050,1861,東証1部,(株)熊谷組,総合建設準大手。歴史的にトンネル等大型土木に強み、大型マンション建築、耐震工事に傾斜
2050,1865,東証1部,青木あすなろ建設(株),高松コンストラクＧ傘下。みらい建設等海上土木に強み。不動産事業に進出。受注計画非公表
2050,1866,東証1部,北野建設(株),長野地盤、民間建築主力。首都圏の比重は約５割。子会社通じホテル、ゴルフ場などに多角化
2050,1867,東証1部,(株)植木組,新潟県地盤の中堅建設。東京、中部、東北など県外拡大に意欲。子会社で有料老人ホーム等進出
2050,1868,東証1部,三井ホーム(株),三井不動産系住宅メーカーで２×４住宅首位。設計、デザインに強み。構造材はカナダから輸入
2050,1869,名証2部,名工建設(株),発祥は保線工事の中堅ゼネコンでＪＲ東海と密接。ＪＲ向けのほか官公庁、民間でも実績積む
2050,1870,東証1部,矢作建設工業(株),名古屋地区の大手、名鉄と密接。民間建築中心に展開。独自の耐震補強工事でも事業拡大
2050,1871,東証1部,(株)ピーエス三菱,三菱マテリアル系。土木・建築半々を指向。ＰＣ（プレストレストコンクリート）橋梁トップ級
2050,1873,東証JQS,東日本ハウス(株),在来型注文住宅大手。岩手から全国展開。子会社で木材加工、ホテル、地ビール。マンション進出
2050,1878,東証1部,大東建託(株),節税対策で賃貸住宅事業を地主に提案。仲介、管理、家賃保証までの一貫サービス提供に強み
2050,1879,東証1部,新日本建設(株),建設と不動産開発（分譲マンション）が両輪。営業は首都圏中心で地方主要都市や中国にも進出
2050,1881,東証1部,(株)ＮＩＰＰＯ,ＪＸホールディングス系の舗装大手。子会社に大日本土木。民間建築の実績豊富。不動産開発も
2050,1882,東証1部,東亜道路工業(株),独立系道路舗装大手。アスファルト乳剤で最大手。環境事業も手がける。佐藤渡辺に７％強出資
2050,1883,東証1部,前田道路(株),道路舗装大手。施工監理に優れた小型工事が安定収益源。地場密着プラントを持ち合材販売優位
2050,1884,東証1部,日本道路(株),清水建設系の道路舗装大手。社長は歴代生え抜き。地方自治体含め官庁工事で実績。民間も育成
2050,1885,東証1部,東亜建設工業(株),旧浅野系。海上土木が本業で、ＯＤＡはじめ海外展開にも意欲的。陸上土木や建築にも実績
2050,1888,東証1部,若築建設(株),海上土木の中堅。陸上土木にも展開。建築は採算重視で規模を大幅縮小。受注予想は非公開
2050,1890,東証1部,東洋建設(株),海上土木大手。陸上・建築へ展開。フィリピン、ベトナムに強み。前田建設工業との協業推進
2050,1892,名証2部,徳倉建設(株),名古屋地盤の中堅ゼネコン。海洋土木から一般土木、建築に拡大。坂田建設子会社化で関東強化
2050,1893,東証1部,五洋建設(株),海上土木首位。総合建設準大手級。国内建築拡大路線から方向転換。海外大型案件受注に注力
2050,1896,東証1部,大林道路(株),大林組傘下の道路大手。舗装以外に土木工事も３割程度手がける。下水道の管渠更生工事に注力
2050,1897,東証2部,金下建設(株),近畿北部地盤の総合建設。民間建築部門拡充。強みの道路舗装等含め官公需比率漸減。好財務
2050,1898,東証1部,世紀東急工業(株),東急系。道路舗装の中堅。環境対応や景観など技術多彩。優先株取得と借入金返済を推進中
2050,1899,東証1部,(株)福田組,新潟最大規模のゼネコン。県内土木主体から首都圏建築・開発へ展開。西日本でも事業拡大図る
2050,1904,東証JQS,大成温調(株),空調、給水など設備工事中堅。クリーンルーム設計・施工も。中国、ハワイ、インドなどにも展開
2050,1905,東証JQS,(株)テノックス,建設基礎工事の大手。テノコラム工法等独自の３工法武器に公共関連から民間建築を積極開拓
2050,1906,東証JQS,(株)細田工務店,戸建て住宅分譲が主力。施工力生かし請負も。東京杉並を中心に神奈川・千葉など首都圏展開
2050,1911,東証1部,住友林業(株),新築注文住宅と木材建材が２本柱。リフォームや都市開発、米国等での海外事業を育成強化中
2050,1914,東証1部,日本基礎技術(株),地盤改良など基礎工事の専業大手。独自工法武器に民間分野の拡大図る。直営施工体制を強化
2050,1916,東証1部,日成ビルド工業(株),プレハブ建築、立体駐車場の大手総合メーカー。事業用施設プレハブ中心に共同住宅も扱う
2050,1919,東証1部,(株)ヤマダ・エスバイエルホーム,木質プレハブ中堅。国内ファンド支援経てヤマダ電機の傘下入り。スマートハウス相乗効果狙う
2050,1921,東証1部,(株)巴コーポレーション,体育館など大張間構造建築のパイオニア。文教関係に強み。電力鉄塔にも実績。不動産賃貸拡大
2050,1924,東証1部,パナホーム(株),パナソニック傘下の住宅会社。軽量鉄骨プレハブ主力。エコ住宅等グループ力生かした商品展開
2050,1925,東証1部,大和ハウス工業(株),戸建て住宅からマンション・賃貸・商業・事業施設建築へ展開、各分野で有力、都市開発や海外も
2050,1926,東証1部,ライト工業(株),東北が発祥の地。基礎・地盤改良・法面など特殊土木会社。耐震補強にも注力する。好財務
2050,1928,東証1部,積水ハウス(株),鉄骨主力の住宅首位。木造等も強化。全国直販体制に強み。海外でも事業展開。積水グループ
2050,1929,東証1部,日特建設(株),基礎、地盤改良など特殊土木大手。環境、防災に強み。不動テトラと業務提携、アジア進出に意欲
2050,1930,東証1部,北陸電気工事(株),北陸電力系列の電気工事会社。北陸電力向け売上高約４割。地盤の北陸３県から徐々に全国展開
2050,1931,東証2部,日本電通(株),近畿圏地盤の電話・情報通信工事中堅。ＮＴＴ西、日本ＩＢＭと近く、情報システム販売も展開
2050,1933,東証2部,西日本システム建設(株),電気通信工事業者。九州地盤。ＮＴＴ関連工事主体、企業向けＬＡＮ・ＷＡＮ等非ＮＴＴも注力
2050,1934,東証1部,(株)ユアテック,東北電力系列の総合電気工事会社、売上高依存度４割。風力・太陽光発電に実績。首都圏でも展開
2050,1935,東証2部,(株)ＴＴＫ,中堅の電気通信工事業者。地盤の東北地区では最大手。ＮＴＴ向けが６割強、携帯基地局工事も
2050,1936,名証1部,シーキューブ(株),ＮＴＴ工事業者。ＮＴＴ比率高い。東海ではＮＤＳと競う。光関連、情報サービス分野も育成
2050,1937,東証1部,西部電気工業(株),電気通信工事業者。ＮＴＴ工事主体に地盤の九州地区では最大手。情報ボックスやＬＡＮを強化
2050,1938,東証2部,日本リーテック(株),総合電気設備工事。０９年４月千歳電工と保安工業が合併、ＪＲ東日本依存大。電力向け等も展開
