3550,5942,東証1部,日本フイルコン(株),製紙用網メーカーで断トツの国内シェア。フォトマスクも展開、ＰＤＰ用精密部品からは撤退
3550,5943,東証1部,(株)ノーリツ,ガス風呂釜、給湯器専業大手。システムキッチン、太陽光発電等へ展開。米、中を軸に海外育成中
3550,5945,東証JQS,天龍製鋸(株),機械のこ製造で約１００年の実績。木工用丸のこ首位、金属用チップソー拡大。中国、タイに拠点
3550,5946,東証1部,(株)長府製作所,石油給湯器で首位級。太陽熱温水器、冷暖房機等へ多面展開。環境配慮型製品に注力。好財務
3550,5947,東証1部,リンナイ(株),ガス器具トップ。給湯、厨房が２本柱。韓国、中国、米国、豪州など海外にも積極展開。好財務体質
3550,5950,東証2部,日本パワーファスニング(株),工業用ファスナー（ネジ、ピン、ばね）の大手。住宅用が中心。中国子会社では自動車用も生産
3550,5951,東証1部,ダイニチ工業(株),石油ファンヒーター大手。業務用得意。ＪＸの家庭用燃料電池システムを受託。利益は下期偏重
3550,5952,東証2部,アマテイ(株),くぎでトップ。カラーくぎとくぎ打ち機など特殊仕様品で高シェア。樹脂用特殊ネジを育成
3550,5953,福証,昭和鉄工(株),熱源、空調、環境など機器装置を製販。薄型テレビ、太陽電池などにも関連。１８８３年創業
3550,5955,東証2部,(株)ヤマシナ,十字穴ネジが主力。電線も併産。家電、自動車向けが中心。マンションなど賃貸が安定収益源
3550,5956,東証2部,トーソー(株),カーテンレール製造で国内首位。ブラインドも強い。インドネシアなど東南アジア展開を強化中
3550,5957,東証1部,日東精工(株),工業用ネジの大手。ネジ締め機などの産機、計測制御機器にも展開。自動車向けで海外強化
3550,5958,東証1部,三洋工業(株),天井・床・壁下地材の大手。公共施設用、特に学校体育館で高シェア。全国に営業所を展開
3550,5959,東証1部,岡部(株),建設向け仮設型枠・構造機材が主力。米、伊の自動車部品メーカー買収、海外ホテルへも多角展開
3550,5964,東証2部,東洋刃物(株),情報通信、鉄鋼、製紙など向け工業用刃物を製販。専業首位。緑化事業も行う。震災から再建中
3550,5965,東証2部,(株)フジマック,総合厨房設備機器メーカーで外食、ホテル等大型設備に強み。工場を分社化。海外開拓に意欲
3550,5966,東証2部,ＫＴＣ(株),レンチ、スパナなど作業工具製販で首位。自動車関連向けが中心。ＤＩＹ事業は京都で２店営業
3550,5967,東証2部,ＴＯＮＥ(株),工具輸入販売で創業。レンチ、ボルト締結機器メーカー。マキタと提携。ＴＯＮＥに社名変更
3550,5969,東証2部,(株)ロブテックス,ロブスター印のレンチなど工具が柱。空気鋲打ち機を拡販。ゴルフ練習場兼営。１８８８年創業
3550,5970,東証JQS,(株)ジーテクト,ホンダ系の自動車骨格プレス部品メーカー。１１年菊池プレスが高尾金属を吸収、海外積極展開
3550,5971,東証JQS,(株)共和工業所,六角ボルトなど建設機械用高強度ボルトの専業大手。コマツ向けが主力。自動車関連を育成
3550,5973,東証2部,(株)トーアミ,コンクリート補強の土木建築用溶接金網トップ。関東、関西、中部地盤に全国展開。技術力定評
3550,5974,東証1部,中国工業(株),家庭用ＬＰガス容器の最大手。高炉コンベヤー、飼料タンク展開。子会社でトラック輸送と倉庫
3550,5975,東証1部,東プレ(株),独立系のプレス部品メーカー大手。プレス事業は日産向け約６割。冷凍車は国内シェア３割占有
3550,5976,東証1部,ネツレン(株),鋼材焼入など高周波熱処理加工大手。熱処理受託加工、誘導加熱（ＩＨ）装置、鋼製品が３本柱
3550,5979,名証2部,カネソウ(株),マンホール蓋、溝蓋、排水金具等の金属金具を製造。免震関連製品を主力商品に首都圏を拡大
3550,5981,東証1部,東京製綱(株),ワイヤロープ老舗で最大手。タイヤ用スチールコード大手、道路安全施設やアジア展開に注力
3550,5982,東証2部,(株)マルゼン,業務用厨房大手、外食店向けに強み。自社製品比率高い。Ｍ＆Ａでベーカリー機器にも進出
3550,5983,東証JQS,イワブチ(株),電力架線用金具で首位、交通信号用金具市場ほぼ独占。ＣＡＴＶ・情報通信関連分野にも進出
3550,5984,東証2部,兼房(株),工業用機械刃物の専業メーカー最大手。木工用の丸のこ・刃類が特に強い。非住宅向け販売注力
3550,5985,東証1部,サンコール(株),トヨタ、ホンダ向け中心にばね、リングなど精密部品製造。ＨＤＤ部品、プリンタ用ローラーも
3550,5986,東証1部,モリテック　スチール(株),自動車向けみがき特殊鋼の専門商社。部品製造に注力。タイ、インドネシア等アジア進出本格化
3550,5987,東証JQS,(株)オーネックス,機械部品などの総合金属熱処理専業。ガス浸炭熱処理に強い。受注は工作機４割、自動車４割
3550,5988,東証1部,(株)パイオラックス,自動車向けの精密ばねと工業用ファスナーが両輪。日産グループ向け５割。医療機器も育成
3550,5989,東証JQS,(株)エイチワン,車体骨格部品のヒラタと本郷が合併し誕生。アンダーボディ骨格品等主体。９割弱がホンダ向け
3550,5990,東証JQS,(株)スーパーツール,レンチ等作業工具の大手。治工具類、吊りクランプ等の産業機器も。太陽光パネル販売に進出
3550,5991,東証1部,ニッパツ,独立系自動車部品メーカー。懸架ばね首位。シートも。ＨＤＤ基幹部品の精密ばねも手掛ける
3550,5992,東証1部,中央発條(株),自動車ばねの大手メーカー。トヨタ系向け６割弱。非自動車向けも強化。海外展開にも積極的
3550,5993,名証2部,知多鋼業(株),２輪・４輪車ばねが主力の自動車部品メーカー。独立系で、建機や歯科医療部品も開拓へ
3550,5994,東証2部,(株)ファインシンター,粉末冶金部品メーカーで自動車向けが８割。モーターポンプ等油圧機器、鉄道車両用部品も製造
3550,5997,東証JQS,協立エアテック(株),空調機器専業で中堅。ダンパーのシェア約３割で首位。２４時間換気装置など住宅用途を深耕中
3550,5998,東証1部,(株)アドバネクス,精密ばね大手。線ばねに強み。プラスチック成形品も。加藤雄一氏は会長職に専念、脱同族志向
3550,5999,東証JQS,イハラサイエンス(株),産業用継ぎ手最大手、半導体向けに強み。創業者同士が親しかったユニ・チャームが大株主
3550,7985,東証2部,ネポン(株),施設園芸用温風暖房機など熱機器が主力。簡易水洗トイレ等の衛生機器も展開。農産物販売も
3550,7989,東証2部,立川ブラインド工業(株),ブラインドと間仕切りのトップメーカー。子会社で減速機、駐車場事業展開。東リと株持ち合い
3550,8155,東証1部,三益半導体工業(株),信越化学からウエハ研磨加工を受託。使用済みウエハ再生、半導体関連装置の設計や卸売りも
3550,9922,東証2部,日立機材(株),日立金属系の建材機器（床材、鋼構造部材、チェーン等）メーカー。アジアはじめ海外展開を推進
3600,1909,東証2部,日本ドライケミカル(株),消火に強い防災設備機器大手。外資の買収受け００年非上場化、１１年再上場。初田製作所等と提携
3600,1978,東証1部,アタカ大機(株),日立造船系。０６年大機エンジニアリングと合併。水処理、環境保全装置等の環境事業を展開
3600,5631,東証1部,(株)日本製鋼所,大型鋳鍛鋼で世界有数、電力・原子力向け製品が収益柱。射出成形機でも上位。火砲手掛ける
3600,6005,東証1部,三浦工業(株),産業小型ボイラーで国内５割超占有。メンテが安定収益源。水処理や環境事業育成。海外開拓
3600,6013,東証1部,(株)タクマ,ボイラー基盤にゴミ焼却炉、水処理装置へ展開。ストーカ炉に強い。バイオマス発電プラントも
3600,6022,東証2部,(株)赤阪鐵工所,舶用ディーゼルエンジン専業の中堅。三菱重工と連携。小型・省エネ型を強化。非舶用分野を育成
3600,6101,東証1部,(株)ツガミ,小型自動旋盤の首位。スマホや自動車向け強い。新興国開拓重視。中国子会社の香港上場検討中
3600,6103,東証1部,オークマ(株),東海の工作機械大手。マシニングセンタ（ＭＣ）などトップ級。国内生産、基礎技術開発に重点
3600,6104,東証1部,東芝機械(株),射出、ダイカストなど成形機が主軸。大型工作機械も得意。持分対象に半導体製造装置会社
3600,6111,名証2部,旭精機工業(株),銃弾類、水晶振動子用ケース主力からプレス機、ばね機械、航空機部品などに展開。輸出も強化
3600,6112,東証2部,(株)小島鐵工所,大型油圧プレス機の中堅メーカー。鋳造で創業。輸出は韓国が主。収益計上は工事進行基準
3600,6113,東証1部,(株)アマダ,金属加工機械で国内首位級。特に板金機械はトップ。割賦販売で中小企業開拓、海外積極的
3600,6118,東証1部,アイダエンジニアリング(株),プレス機専業世界２位。自動車関連約８割、非日系顧客の開拓進み拡大中。世界４極生産体制
3600,6121,東証1部,(株)滝澤鉄工所,工作機械中堅。ＮＣ旋盤主力に、複合加工機等も。自動車向け５割超。台湾と上海に子会社
3600,6125,東証2部,(株)岡本工作機械製作所,平面研削盤で国内首位。液晶、半導体製造装置も手掛ける。汎用機はタイ、シンガポールで生産
3600,6131,東証2部,浜井産業(株),半導体、ＨＤＤ、ＬＥＤなど電子部品材料の研磨機（ラップ盤）が主軸。部品加工用ホブ盤も製造
3600,6134,名証1部,富士機械製造(株),電子部品向けなど自動装着装置トップ。高速機に強い。自動車部品用工作機械も。輸出比率大
3600,6135,東証1部,(株)牧野フライス製作所,工作機械上位。金型・部品用マシニングセンタ（ＭＣ）が柱。先端志向の技術に自信。アジア強い
3600,6136,東証1部,ＯＳＧ,精密切削工具大手。タップ・エンドミル等で高シェア。自動車向け比率高い。超硬切削工具強化
3600,6137,東証2部,小池酸素工業(株),鉄鋼、造船、建機向け厚板切断機などの機械装置と高圧ガスが２本柱。ガス事業で医療機器も
3600,6138,東証1部,ダイジェット工業(株),総合超硬工具メーカー上位。最終需要では自動車向けが中心。焼肌チップ縮小し切削工具に傾注
3600,6140,東証1部,旭ダイヤモンド工業(株),ダイヤモンド工具国内首位。半導体、自動車、機械、石材・建築など顧客多彩。自己資本厚い
3600,6141,東証1部,ＤＭＧ森精機(株),ＮＣ旋盤・マシニングセンタ（ＭＣ）で最大手格。世界４極体制確立。独ギルデと業務資本提携
3600,6142,名証2部,富士精工(株),超硬工具中堅。試作品も製造。トヨタグループとの取引大。インドネシア、中国などでも生産
3600,6143,東証2部,(株)ソディック,放電加工機世界２位、国内首位。独自技術に強み。射出成形機や食品機械（製麺機）も育成
3600,6144,東証2部,西部電機(株),搬送機械、産業機械、工作機械の３本柱。産機は公共、電力が軸。収益は下期偏重。安川電機と親密
3600,6145,東証JQS,日特エンジニアリング(株),コイル用自動巻線機最大手で全自動システム機に特色。ＦＡ企業志向。単独配当性向３０％基準
3600,6146,東証1部,(株)ディスコ,半導体、電子部品向け切断、研削、研磨装置で世界首位。装置と消耗品のダイヤ砥石が２本柱
3600,6147,東証JQS,(株)ヤマザキ,工作機と２輪車用部品が柱。ヤマハ発動機向け４割、工作機は自動車業界に依存。ベトナム進出
3600,6149,東証JQS,(株)小田原エンジニアリング,モーター用自動巻線機で国内首位、世界でも２位。自動車用、家電用が主力。アジア比率が急増
3600,6150,東証JQS,タケダ機械(株),鉄骨加工機大手メーカー。鋼材加工業者中心に自動車業界などが得意先。中国、韓国等に代理店
3600,6151,東証1部,日東工器(株),配管の簡易接続器具である迅速流体継ぎ手の最大手。自社開発製品に強み。海外展開に積極的
3600,6155,東証2部,高松機械工業(株),中小型ＮＣ旋盤中堅。顧客密着の特注機多い。自動車用６０％前後。部品加工、液晶等製造装置も
3600,6156,東証JQS,(株)エーワン精密,旋盤用コレットチャックとカム高シェア。特殊切削工具育成。超短納期武器に高利益率、無借金
3600,6157,東証JQS,日進工具(株),切削工具中堅。精密金型や部品加工向け超硬小径エンドミルに特化しＯＳＧと双璧。無借金
3600,6158,東証JQS,(株)和井田製作所,工作機械中堅。切削工具用と金型用の特殊研削盤で国内首位。海外同業との提携に積極的
3600,6159,東証JQS,ミクロン精密(株),心なし研削盤国内首位でシェア４割、内面研削盤が成長。自動車向け過半。米国、タイに営業拠点
3600,6161,マザーズ,(株)エスティック,ナットランナ（ネジ締め機器）国内首位級。自動車向け主体。独自の電動式で差別化。海外強化中
3600,6163,東証JQS,(株)エイチアンドエフ,自動車向け中心に大中型プレス機器を製造。アフターサービスを世界に展開。日立造船グループ
3600,6164,東証JQS,(株)太陽工機,新潟地盤の工作機械中堅。立形研削盤で国内首位。北米軸に海外向け拡大中。森精機子会社
3600,6165,東証2部,パンチ工業(株),金型部品国内２位。中国は８０００社の顧客基盤持ちシェアトップ級。短納期販売に強み
3600,6203,東証1部,豊和工業(株),産業用機械の老舗。工作機械が主力。火器、防音サッシなど防衛需要大。創業事業の紡機は撤退
3600,6205,東証1部,ＯＫＫ,中小型マシニングセンタが主力。自動車関連向けシステムに強み。水道メーターも手掛ける
3600,6208,東証1部,(株)石川製作所,段ボール製函印刷機主体の機械メーカー。繊維機械で出発し防衛機器も。レンゴーが筆頭株主に
3600,6210,東証1部,東洋機械金属(株),日立グループ。小型の射出成形機、電動ダイカストマシンに強み。中型射出成形機を強化
3600,6217,東証1部,津田駒工業(株),繊維機械の総合首位。ジェットルームは世界１位。中国向けほか輸出が大半。工作機械関連も
3600,6218,東証1部,エンシュウ(株),自動車用工作機械とヤマハ発動機向け部品加工が柱。レーザー加工機等も。丸紅と業務提携
3600,6222,東証1部,(株)島精機製作所,電子制御横編み機の世界最大手。国内独占、海外４割のシェア。デザインシステムも手掛ける
3600,6245,東証2部,(株)ヒラノテクシード,塗工・化工・各種熱処理機械が主力。電気・電子、高分子化学の高精度薄膜塗工で業界をリード
3600,6246,東証2部,(株)テクノスマート,繊維用から各種塗工乾燥機へ総合化で「技術革新型企業」目標。中国、台湾、韓国向け比率高い
3600,6247,東証1部,(株)日阪製作所,プレート式熱交換器、染色機械で首位。食品、医薬など生活産業機器を強化。配当性向３０％以上
3600,6248,東証JQS,(株)横田製作所,耐腐食・耐摩耗性ポンプが強み。独立系でニッチ市場特化。石火発電所用自吸ポンプで高シェア
3600,6249,東証JQS,(株)ゲームカード・ジョイコホールディングス,遊技機用プリペイドカードシステム大手。日本ゲームカードとジョイコシステムズが統合
3600,6250,東証1部,(株)やまびこ,屋外作業機械メーカーで国内首位、米州上位。共立と新ダイワ工業が統合。利益は上期偏重
3600,6254,東証JQS,野村マイクロ・サイエンス(株),超純水装置の大手。北興化学から分岐。韓国、台湾市場開拓で先駆、韓国サムスンとの取引多い
3600,6255,マザーズ,(株)エヌ・ピー・シー,祖業は食品用真空包装機。太陽電池の後工程向け装置で大手。太陽電池モジュール受託加工も
3600,6256,東証JQS,(株)ニューフレアテクノロジー,半導体製造装置メーカー。東芝機械から分社。電子ビームマスク描画装置で世界シェア首位
3600,6257,東証JQS,(株)藤商事,パチンコ、パチスロ機中堅メーカー。大阪発祥。「宇宙戦艦ヤマト」がヒット。サン電子と提携
3600,6258,東証JQS,平田機工(株),生産エンジニアリングメーカー。自動車や半導体、家電関連など顧客多彩。産業用ロボットも
3600,6259,東証JQS,大崎エンジニアリング(株),大崎電気系の薄型パネル製造装置メーカー。ＰＤＰ用実装装置で国内首位。液晶、半導体向けも
3600,6260,東証JQS,(株)アドテックエンジニアリング,電子回路を基板に焼き付ける露光装置を製造。全自動式でシェア３０％。ウシオ電機連結子会社
3600,6262,東証1部,ペガサスミシン製造(株),伸縮性ある生地に適した環縫いミシンでトップ。海外は中国、アジア中心。自動車用金型部品も
3600,6264,マザーズ,(株)マルマエ,液晶、半導体、太陽電池製造装置の精密部品加工業。大型高精度品強い。産活法活用し再建中
3600,6265,東証JQS,(株)妙徳,真空吸着搬送機器メーカー。自動車関連、電子産業向けが多い。中国、韓国など海外を強化
3600,6266,東証JQS,タツモ(株),液晶カラーフィルター用塗布装置で世界シェア首位。独自技術持つ。東京応化工業と密接
3600,6267,東証JQS,ゼネラルパッカー(株),自動包装機械の中堅。食品向けが主体。粉末、顆粒向けに特化。ワイ・イー・データが筆頭株主
3600,6268,東証1部,ナブテスコ(株),産業ロボット用精密減速機で世界シェア６割、自動ドア世界首位級、鉄道用ブレーキも強い
3600,6269,東証1部,三井海洋開発(株),浮体式の原油生産貯蔵設備（ＦＰＳＯ）を設計・建造。工事は外部活用。完成後に合弁通じリース
3600,6271,東証2部,(株)ニッセイ,ブラザー工業の連結子会社。自動化機械など向け中型減速機や自動車歯車のメーカー。無借金
3600,6272,東証1部,レオン自動機(株),練り技術を基礎に食品成形機展開。包あん成形機や製パン機が主力。米国製パン事業が育つ
3600,6273,東証1部,ＳＭＣ(株),ＦＡ空圧制御機器で世界首位。国内シェア６割、海外３割。顧客の業種幅広く収益基盤厚い
3600,6274,東証1部,(株)新川,半導体用結線装置（ワイヤボンダ）世界上位、接着装置育成。ＬＥＤ向けなど用途拡大。無借金
3600,6276,東証JQS,ナビタス(株),ホットスタンプ印刷や成形転写装置等の特殊印刷機総合メーカー。検査装置など新分野強化
3600,6277,東証1部,ホソカワミクロン(株),粉体関連装置で業界首位。欧州強い。プラスチック薄膜製造装置も展開。日清エンジと業務提携
3600,6278,東証1部,ユニオンツール(株),ＰＣＢ（プリント配線板）ドリルで世界シェア３割超の首位。直動軸受けも。有利子負債ゼロ
3600,6279,東証2部,(株)瑞光,衛生用品製造機の国内最大手。子供用紙オムツ、生理用ナプキン向け断トツ。中国に生産子会社
3600,6280,名証2部,(株)名機製作所,射出成形機の草分け大手。国内で初めてプラスチック射出成形機を開発。自動車業界向けが主体
3600,6281,東証JQS,(株)前田製作所,前田建設系。コマツ総代理店最大手級。かに・クローラークレーンなど好採算の自社機器を強化
3600,6282,東証1部,オイレス工業(株),無給油式ベアリングで国内シェア５割。開発に力を入れ保有特許多い。免震装置でも高シェア
3600,6284,東証1部,日精エー・エス・ビー機械(株),食品、飲料容器成形機メーカー。世界２位グループ。海外比率９割。インドを生産拠点にする
3600,6286,東証JQS,靜甲(株),包装プラント主力。自動車、工具向け冷間鍛造部品強い。ＦＡ機器、スバル車の代理店販売も
3600,6287,東証1部,サトーホールディングス(株),バーコード、プリンタなど自動認識システムで世界首位級。海外拡大。Ｍ＆Ａで低価格機に参入
3600,6289,東証2部,(株)技研製作所,油圧式杭圧入引抜機等を製造。圧入工事は特殊工事特化など開発型企業に転換中。地下駐輪場も
3600,6291,東証1部,日本エアーテック(株),クリーンルームと関連機器の専業メーカー。電子、バイオ分野が主な需要先。北関東に製造拠点
3600,6292,東証2部,(株)カワタ,プラスチック成形・合理化周辺機器トップ級。アジア軸に海外展開。国内は非成形機分野育成
3600,6293,東証1部,日精樹脂工業(株),射出成形機最大手で周辺機器、金型、部品等に展開。専用機は内製、汎用機は外注。海外強化
3600,6294,東証2部,オカダアイヨン(株),破砕・解体用建機メーカー。環境機械の仕入れ販売も。米国に販売子会社。アジア開拓進める
3600,6295,名証2部,富士変速機(株),変減速機から出発、機械式立体駐車場装置で４位群。立川ブラインド工業の子会社。無借金
3600,6297,東証JQS,鉱研工業(株),地下資源工事用掘削機械で有数。温泉開発工事など施工も行う。日立建機と提携。アジア深耕中
3600,6298,東証1部,ワイエイシイ(株),各種自動化機器の中堅。メモリディスク関連・液晶関連装置が主力化。太陽電池製造装置に参入
3600,6299,東証2部,(株)神鋼環境ソリューション,神戸製鋼所グループの環境装置メーカー。水処理、ゴミ焼却に強い。攪拌機など化学機械も有力
3600,6300,東証2部,アピックヤマダ(株),半導体後工程装置メーカー。樹脂封止成形装置で大手。近年は先端機の開発・製造に軸足
3600,6301,東証1部,コマツ,建設機械で世界２位。中国などアジアで首位。ＩＴ活用強み。基幹部品は日本、組み立て現地化
3600,6302,東証1部,住友重機械工業(株),重工大手の一角。変減速機、射出成形機に強い。建設機械やがん治療装置、タンカー造船なども
3600,6303,東証2部,(株)ササクラ,海水淡水化装置の大手。船舶用造水装置や排水処理装置も強み。近年は水冷媒放射空調を事業化
3600,6305,東証1部,日立建機(株),油圧ショベル軸に国内２位、世界３位圏。米欧亜含む最適生産体制推進。日立製作所と連携強化
3600,6306,東証1部,日工(株),土木用プラントメーカー。アスファルトプラントで首位。環境機械も手掛ける。中国で現地生産
3600,6307,東証2部,サンセイ(株),ビル用ゴンドラ、舞台装置のパイオニア。レンタルゴンドラや船舶修理、魚礁など海洋関連も
3600,6309,東証1部,巴工業(株),中堅化学機械メーカー。デカンター型遠心分離機で国内首位。輸入化学品商材の扱い大きい
3600,6310,東証1部,井関農機(株),農業機械専業で３位。コンバイン、田植機に強み。稲作・野菜関連機械、農業用施設にも注力
3600,6312,東証JQS,フロイント産業(株),製薬向け造粒・コーティング装置が柱。食品・化成品素材供給も。生産は大半外注。欧米に拠点
3600,6314,東証JQS,(株)石井工作研究所,半導体製造後工程装置メーカー。切断・成形、マーキング、製品検査等が領域。住宅・環境も
3600,6315,東証1部,ＴＯＷＡ(株),封止や切断加工など半導体後工程用製造装置大手。精密金型製作に競争力。中国等に生産拠点
3600,6316,東証1部,(株)丸山製作所,防除機の大手で農家向けが７割占める。刈払機、噴霧機、消防機械、工業用高圧ポンプにも強み
