6050,9986,東証2部,蔵王産業(株),清掃・洗浄機器の輸入販売商社。ビルメンテ業界と製造業が主顧客。設備投資に左右されやすい
6050,9987,東証1部,(株)スズケン,医薬品卸大手。独立系。Ｍ＆Ａ含め全国に営業網拡大。子会社で糖尿病薬等の医薬品製造も
6050,9991,東証1部,ジェコス(株),仮設鋼材リースの最大手。建機レンタルでも大手、旧川崎製鉄（現ＪＦＥ）系。工事にも実績
6050,9992,東証JQS,(株)理研グリーン,クミアイ化学系。ゴルフ場など緑化薬剤販売や工事施工が主。製紙向け産業用薬品も。税負担高
6050,9995,東証JQS,(株)ルネサスイーストン,半導体商社。０９年合併でルネサス直系に。日立製等表示デバイスも。産業、自動車関連向け得意
6050,9996,東証JQS,(株)サトー商会,東北、北関東地盤。量販店、レストラン、各種給食向け業務用食材卸。業務用食材の小売りも
6100,2651,東証1部,(株)ローソン,三菱商事傘下で業界２位。全国展開で西日本強い。生鮮コンビニ、チケット・音楽ソフト事業も
6100,2652,マザーズ,(株)まんだらけ,マンガ専門古書店の最大手。アニメ原画・玩具販売も。独自の値付け・鑑定で市場影響力大
6100,2653,東証JQS,イオン九州(株),イオン系列。九州全域に総合スーパー（ＧＭＳ）を展開。ＨＣやスーパーセンター（ＳＵＣ）も
6100,2655,東証2部,マックスバリュ東北(株),イオン系列。秋田、山形、青森、岩手で食品スーパーを展開。事業取得で新潟にもエリア拡大
6100,2656,東証JQS,(株)ベクター,ソフトバンクグループ。オンラインゲームで急成長も不正アクセスで失速。体勢立て直しに全力
6100,2659,東証1部,(株)サンエー,沖縄流通最大手。スーパー軸に外食等展開。ローソンと合弁でコンビニも。ニチリウグループ
6100,2660,東証1部,(株)キリン堂,大阪地盤、関西地区で高シェアのドラッグストア。調剤併設化を積極推進。中国でも小売り展開
6100,2662,東証1部,(株)ダイユーエイト,福島地盤の中堅ホームセンター（ＨＣ）。食品スーパーやドラッグストアも展開。苗事業に進出
6100,2664,東証1部,(株)カワチ薬品,栃木地盤。北関東、東北にもドラッグチェーンを展開。小型店の出店に注力中。食品比率が高い
6100,2666,東証JQS,(株)オートウェーブ,千葉県地盤のカー用品店。直営基本に１１店展開。性急な店舗拡大で一頓挫。りそな銀の支援続く
6100,2669,東証JQS,カネ美食品(株),中部地盤。スーパー店内での総菜販売と、コンビニ向けおにぎり、弁当が２本柱。ユニーと密接
6100,2670,東証1部,(株)エービーシー・マート,靴小売専門店「ＡＢＣマート」を全国展開。スポーツ、レディス向け強化中。韓国、台湾にも展開
6100,2673,東証JQS,夢みつけ隊(株),中高年男性向け通信販売。主力はカタログ「夢みつけ隊」。限定商品や趣味性高い雑貨中心
6100,2674,東証1部,(株)ハードオフコーポレーション,総合リユース業、ＰＣ、音響、家電、衣料、家具、カー用品、酒類など８業態を直営、ＦＣ店で展開
6100,2675,東証2部,(株)ダイナック,サントリー外食事業の中核。「響」「パパミラノ」等レストランとゴルフ場内食堂受託の２本柱
6100,2678,東証1部,アスクル(株),オフィス用品配達サービス先駆。文具プラスの事業部から独立。ヤフーと個人通販で全面提携
6100,2681,東証1部,(株)ゲオホールディングス,ビデオ、ＣＤ、ＤＶＤ、ゲームソフト、本等のレンタル、リサイクル、販売。直営店軸に展開
6100,2683,東証2部,(株)魚喜,鮮魚小売り、持ち帰りずし展開。首都圏主体に中国地方まで出店。回転ずしなど外食も手掛ける
6100,2685,東証1部,(株)アダストリアホールディングス,「グローバルワーク」等複数のカジュアル衣料ブランド店をＳＣ等に展開。アジア展開加速中
6100,2686,名証2部,(株)ジーフット,紳士・婦人靴を販売。中部地盤に全国展開。０９年２月にニューステップと合併、イオン子会社に
6100,2687,東証1部,(株)シー・ヴイ・エス・ベイエリア,千葉、東京湾岸でコンビニＦＣ展開、サンクスからローソンへ全店転換。クリーニング事業等も
6100,2694,東証JQS,(株)ジー・テイスト,回転ずしや居酒屋を直営・ＦＣで展開。神戸物産傘下。ジー・ネットワークス、さかいを１３年吸収
6100,2695,東証1部,(株)くらコーポレーション,関西圏地盤。ロードサイド型の回転ずし店「くら寿司」を直営で展開。店舗運営のＩＴ化先行
6100,2698,東証1部,(株)キャンドゥ,１００円ショップ大手。テナント出店中心。食品も扱い主婦の支持高い。既存店の活性化に注力
6100,2702,東証JQS,日本マクドナルドホールディングス(株),外食国内首位級。世界的ハンバーガーチェーン。直営は大都市圏中心に展開。米国本社の影響大
6100,2705,東証JQS,(株)大戸屋ホールディングス,定食専門店「大戸屋ごはん処」を直営・ＦＣで首都圏中心に展開。店舗調理が特徴。弁当事業も
6100,2706,東証JQS,(株)ブロッコリー,ゲームソフト「うたの☆プリンスさまっ♪」シリーズをＰＳＰ向けに展開。関連ＣＤなど物販も
6100,2712,東証JQS,スターバックス　コーヒー　ジャパン(株),カフェ最大手。米スターバックスとサザビーリーグの合弁。モカ、ラテなどコーヒー飲料に強み
6100,2719,東証2部,(株)キタムラ,写真専門チェーン最大手。デジカメ販売やプリント展開。年賀状印刷、七五三撮影も積極推進
6100,2722,東証JQS,(株)アイケイ,通信販売代行や通販向け卸事業展開。生協向け強み。韓国化粧品スキンフードの直販を強化中
6100,2726,東証1部,(株)パル,ヤングレディス衣料や雑貨中心に多ブランド展開。自社企画比率高い。傘下にナイスクラップ
6100,2730,東証1部,(株)エディオン,家電量販上位。中部、西日本が地盤。１２年１０月店舗ブランドをエディオンに統一。住宅設備強化中
6100,2734,東証1部,(株)サーラコーポレーション,中部ガス系３社の持株会社。ＬＰガス、輸入車販売が柱。ペット関連強化。愛知、静岡地盤
6100,2735,東証2部,(株)ワッツ,１００円ショップ業界中堅。直営小型店を軸にした小商圏に強み。Ｍ＆Ａに積極的。海外展開も
6100,2736,東証JQS,(株)サダマツ,宝飾品の製造および小売りチェーン。全国の百貨店やＳＣに幅広く展開。眼鏡、時計も扱う
6100,2742,東証JQS,(株)ハローズ,岡山地盤の食品スーパー。２４時間営業に特徴。中国、四国地方にドミナント出店し効率化
6100,2747,東証JQS,北雄ラッキー(株),札幌圏中心に道内一円で食品スーパー展開、衣料専門店も。有機・無農薬の生鮮品で大手に対抗
6100,2752,東証JQS,(株)フジオフードシステム,大阪地盤に全国で大衆セルフ食堂「まいどおおきに食堂」を展開。うどん、串揚げ業態を育成中
6100,2753,東証1部,(株)あみやき亭,東海地盤の焼き肉チェーン。国産牛肉使う「あみやき亭」が柱。焼き鳥「美濃路」も。好財務
6100,2754,東証JQS,(株)東葛ホールディングス,千葉県北西部を拠点とするホンダ系ディーラー。中古車ティーエスシー３店含め１２拠点展開
6100,2762,東証2部,(株)三光マーケティングフーズ,都内中心に低価格居酒屋「金の蔵Ｊｒ．」等を展開。焼き牛丼「東京チカラめし」を育成中
6100,2764,東証1部,(株)ひらまつ,創業者の平松氏が経営者とシェフ兼任、高級フランス料理店など展開。中価格帯も鋭意拡充中
6100,2769,東証JQS,(株)ヴィレッジヴァンガードコーポレーション,書籍軸にＣＤ、雑貨、食品等を融合した「遊べる本屋」。ＶＶ以外にエスニック雑貨店も育成
6100,2772,東証1部,ゲンキー(株),福井地盤のドラッグストア。岐阜、愛知などへの展開も。食品比率高く、ディスカウント色強い
6100,2778,東証JQS,(株)パレモ,ユニー子会社。婦人衣料の専門店チェーン。イオン、ユニーへの出店多い。１２年２月鈴丹を吸収
6100,2780,東証2部,(株)コメ兵,名古屋・大須が本拠。中古品８割。新品販売も。ブランド品を主柱に衣類拡大。関東に積極出店
6100,2782,東証JQS,(株)セリア,１００円ショップ２位。東海地盤に全国展開。ＰＯＳシステムを積極活用。ＦＣ軸に海外展開
6100,2786,東証JQS,(株)サッポロドラッグストアー,北海道地盤のドラッグストア。道内２位。食品、日用品に強み。４種の店舗形態で全商圏カバー
6100,2789,東証JQS,(株)カルラ,宮城地盤。東北、北関東の小商圏中心に和食ファミレス「まるまつ」展開。カニ、そば等専門店も
6100,2790,東証JQS,(株)ナフコ,家具販売からスタート。家具専門店とＨＣ併合店が主。九州、中国地盤だが関西、関東等にも展開
6100,2791,東証1部,大黒天物産(株),岡山地盤の食品ディスカウントストア。ＳＣ向け複合大型店「ラ・ムー」、単独店「ディオ」を展開
6100,2792,東証1部,(株)ハニーズ,１０〜３０代向けレディスカジュアル・服飾雑貨の製造小売り。ＳＣ中心に展開。中国出店強化中
6100,2796,東証JQS,ファーマライズホールディングス(株),調剤薬局中堅。買収含め西日本で出店攻勢。中堅医薬卸３社や伊藤忠商事と業務・資本提携
6100,2798,マザーズ,(株)ワイズテーブルコーポレーション,高級レストラン、カジュアル伊料理などを直営・ＦＣで展開、ブライダル事業も。アジア開拓中
6100,3011,東証2部,(株)バナーズ,発祥は製糸業の旧松佳。０２年に投資グループが経営参画。不動産賃貸と自動車販売が２本柱
6100,3020,東証JQS,アプライド(株),九州地盤。西日本を軸にパソコン小売店「アプライド」展開。大学など法人向けにシステム提案
6100,3021,マザーズ,(株)パシフィックネット,中古ＰＣ販売。引き取り回収やレンタル、中古携帯販売も展開。自社でデータ消去等の体制整備
6100,3027,東証JQS,(株)レデイ薬局,中堅ドラッグチェーン。中国、四国に集中出店し四国トップ。顧客の相談に応じる対面販売重視
6100,3028,東証1部,(株)アルペン,スポーツデポ、ゴルフ５などスポーツ用品店を全国展開。ＰＢ商品に強み。フィットネス事業も
6100,3030,東証JQS,(株)ハブ,首都圏中心に英国風パブ「ＨＵＢ」、ウイスキー主体の「８２」を展開。外食のロイヤルＨＤ系
6100,3032,名古屋セ,(株)ゴルフ・ドゥ,中古ゴルフクラブ等の専門店を運営。新品の取り扱いも。直営店は首都圏が中心。ＦＣも展開
6100,3034,東証1部,クオール(株),調剤薬局上位。首都圏から地方へ展開。ローソンやビックカメラ、ＪＲ西との共同出店で差別化
6100,3046,東証1部,(株)ジェイアイエヌ,均一料金のアイウエア（眼鏡）販売「ジンズ」ブランド展開。ファッション雑貨の卸、小売りも
6100,3048,東証1部,(株)ビックカメラ,首都圏のカメラ系量販店で駅前出店に特化。コジマ買収で業界２位に浮上。子会社にソフマップ
6100,3050,東証1部,ＤＣＭホールディングス(株),ホームセンター（ＨＣ）業界首位。傘下に北海道のホーマック、中京のカーマ、四国のダイキなど
6100,3057,名古屋セ,(株)ゼットン,東海、関東地区で飲食店運営。チェーン展開せず公共施設への出店に注力。ブライダル事業も
6100,3058,東証JQS,(株)三洋堂ホールディングス,東海軸に郊外型の大型書店を展開。全店標準の効率経営に強み。雑貨、古本を扱う複合店を強化
6100,3059,東証2部,ヒラキ(株),靴や衣料の通販を中心に、卸販売、小売店など展開。４９９円スニーカーなど超低価格帯に強み
6100,3063,マザーズ,(株)ジェイグループホールディングス,居酒屋「芋蔵」や「ほっこり」など飲食店を東海地盤に展開。大型結婚式場や不動産事業も
6100,3064,東証1部,(株)ＭｏｎｏｔａＲＯ,工場用間接資材のネット通販会社。米国間接資材通販大手が親会社。中心客は中小製造業者
6100,3065,東証JQS,(株)ライフフーズ,関西地盤の和食外食チェーン。主力は郊外店「ザめしや」。低価格の「讃岐製麺」「街かど屋」育成
6100,3066,名証2部,(株)ＪＢイレブン,ラーメン「一刻魁堂」、中華「ロンフーダイニング」を展開。東海地盤、ＳＣ内中心に直営展開
6100,3067,マザーズ,(株)東京一番フーズ,国産の養殖フグ専門店「とらふぐ亭」を関東で展開。冬の上半期に売り上げ、利益を稼ぐ構造
6100,3068,東証JQS,(株)ＷＤＩ,ダイニングレストランの老舗。パスタ「カプリチョーザ」他、国内外ブランドを直営・ＦＣで展開
6100,3069,東証JQS,(株)アスラポート・ダイニング,外食「牛角」、釜飯店「とりでん」等のＦＣ本部。０９年、居酒屋営む食品卸の阪神酒販傘下に
6100,3071,マザーズ,(株)ストリーム,ＰＣ、家電の低価格販売サイト「ＥＣカレント」等を運営。ベスト電器と家電仕入れなどで提携
6100,3073,東証JQS,(株)ダイヤモンドダイニング,首都圏軸に立地ごとのコンセプト居酒屋を展開。開発力強み。チェーン居酒屋やネット喫茶も
6100,3075,東証JQS,(株)銚子丸,郊外型回転ずし「すし銚子丸」を直営展開。千葉地盤。１皿１００円〜５００円台と価格多様
6100,3077,東証JQS,ホリイフードサービス(株),北関東地盤の居酒屋、レストランチェーン。「忍家」が主力。他社のフランチャイズは縮小
6100,3080,東証JQS,(株)ジェーソン,低価格帯の加工食品・日用品小売店チェーン。首都圏地盤。仕入れ手法と低コスト運営に特色
6100,3082,東証2部,(株)きちり,女性向け居酒屋「きちり」等を直営展開。関西から関東に軸足移行。ハンバーグ業態を育成中
6100,3083,東証JQS,(株)シーズメン,アメカジ店「ＭＥＴＨＯＤ」をＳＣ内中心に全国展開。和柄が特徴の「流儀圧搾」の出店加速中
6100,3085,東証JQS,アークランドサービス(株),カツ丼専門店「かつや」を直営、ＦＣで展開。天丼育成中。親会社は新潟地盤のホームセンター
6100,3086,東証1部,Ｊ．フロント　リテイリング(株),百貨店大手の大丸と松坂屋ＨＤとが統合。関西、中京圏が地盤。東京店を増床。子会社にパルコ
6100,3087,東証1部,(株)ドトール・日レスホールディングス,傘下にＦＣ主体の喫茶ドトール、直営パスタ店「五右衛門」の日レスなど。コーヒー類の卸売りも
6100,3088,東証1部,(株)マツモトキヨシホールディングス,中小チェーンの買収繰り返し売上高でドラッグストア首位に。ＦＣにも積極的。関東圏に強み
6100,3090,東証JQG,ミネルヴァ・ホールディングス(株),ネット上でキャンプ等アウトドア商品販売。筆頭株主は仏同業オキシレングループの投資会社
6100,3091,東証1部,(株)ブロンコビリー,名古屋地盤。炭焼きステーキ等を提供する郊外型高価格レストラン。関東出店も開始。好財務
6100,3092,東証1部,(株)スタートトゥデイ,アパレル専門ネット通販「ＺＯＺＯＴＯＷＮ」運営。ブランド品在庫買い取り、受託販売を展開
6100,3093,マザーズ,(株)トレジャー・ファクトリー,家電、家具、雑貨等の総合リサイクル店を展開。関東１都４県が地盤、関西へも出店を開始
6100,3094,東証JQS,(株)スーパーバリュー,埼玉を地盤にホームセンター（ＨＣ）と食品スーパーの併設店舗を展開。ローコスト運営
6100,3096,東証JQS,(株)オーシャンシステム,新潟地盤に独自食品スーパー「チャレンジャー」や業務スーパー展開。弁当や宅配、旅館経営も
6100,3097,東証1部,(株)物語コーポレーション,中部地盤。直営・ＦＣで郊外に出店。食べ放題店「焼肉きんぐ」が主力。ラーメンやお好み焼きも
6100,3098,東証1部,(株)ココカラファイン,関東「セイジョー」、関西「セガミ」などが統合し誕生。屋号を順次「ココカラファイン」に統一
6100,3099,東証1部,(株)三越伊勢丹ホールディングス,百貨店首位。０８年４月の経営統合で誕生。旗艦店の新宿伊勢丹、日本橋三越は全国屈指の売上高
6100,3141,東証1部,ウエルシアホールディングス(株),ウエルシア関東と高田薬局が統合。傘下に寺島薬局、イレブン。イオン傘下だが独自色強い
6100,3147,東証JQS,(株)リックコーポレーション,岡山地盤にホームセンター（ＨＣ）とペット店を展開。自転車や農業資材、酒販売など専門店も
6100,3148,東証1部,(株)クリエイトＳＤホールディングス,神奈川県地盤の大手ドラッグストアチェーン。デイサービスなど介護事業も。関東近県に拡大
6100,3159,東証1部,丸善ＣＨＩホールディングス(株),丸善とＴＲＣが統合。１１年に書店大手のジュンク堂、学術書の雄松堂も参加。大日本印刷傘下
6100,3163,東証JQS,(株)トータル・メディカルサービス,福岡地盤の調剤薬局「さくら薬局」が柱。医薬卸と病院給食買収を機に関東圏での事業拡大志向
6100,3169,マザーズ,(株)ミサワ,「ｕｎｉｃｏ」ブランドで家具・雑貨など展開。２０〜３０代の女性が中心顧客。飲食店も運営
6100,3170,東証JQS,(株)アイセイ薬局,かかりつけ薬局軸に東名阪中心の展開。医療モール開発で業界先駆。介護福祉施設も実績豊富
6100,3171,東証JQS,マックスバリュ九州(株),九州地盤のイオン系食品スーパー。破綻した壽屋の受け皿として設立。ディスカウントも運営
6100,3172,東証JQS,ティーライフ(株),ＰＢ健康茶、化粧品などをカタログ、ネットで販売。製品製造など外部に委託し業務スリム化
6100,3174,東証JQS,(株)ハピネス・アンド・ディ,宝飾、時計、バッグ、雑貨などギフト商品を販売。北海道から沖縄まで全国展開。ＰＢにも注力
6100,3175,東証1部,(株)エー・ピーカンパニー,都内中心に居酒屋「塚田農場」等を展開。自社農場で地鶏を育成するなど生産・販売の直結が特徴
6100,3177,東証JQS,(株)ありがとうサービス,ブックオフ、ハードオフＦＣ。フードはモスバーガーＦＣと自社展開。愛媛地盤に九州出店強化
6100,3178,東証2部,チムニー(株),居酒屋「はなの舞」「さかなや道場」を直営・ＦＣ展開。受託食堂を育成中。ファンド支援で再上場
6100,3179,マザーズ,シュッピン(株),カメラを軸に専門性高い商材の中古品や新品をネットと店舗で販売。社長はソフマップ創業者
6100,3181,東証JQS,(株)買取王国,中古品の買取、再販事業。衣料、ホビーが主体、ロードサイド店「買取王国」を東海地盤に展開
6100,3182,マザーズ,オイシックス(株),農薬や添加物の使用に配慮した青果物や加工食品などをネット販売。リアル店舗での販売も
6100,3184,東証JQS,ＩＣＤＡホールディングス(株),三重県拠点のホンダ系ディーラー。ＶＷやアウディなど輸入車販売、自動車リサイクル事業も
6100,3185,マザーズ,夢展望(株),１０代後半〜２０代前半女性向け衣料ネット通販展開。ＳＰＡ（製造小売り）で提供。スマホに強み
6100,3186,マザーズ,(株)ネクステージ,中古車販売中堅。東海地区発祥で全国店舗網形成中。車種別の専門店展開、軽装備店舗に強み
6100,3187,マザーズ,(株)サンワカンパニー,建築資材のインターネット通信販売専業、東京、大阪などとシンガポールにショールーム開設
6100,3313,東証1部,ブックオフコーポレーション(株),中古本販売首位、新刊書店進出。衣料、雑貨など総合型店拡大。大日本印刷、大手出版３社が出資
6100,3317,東証JQS,(株)フライングガーデン,北関東地盤。郊外型レストラン「フライングガーデン」を直営展開。「爆弾ハンバーグ」が売り物
6100,3318,東証JQS,(株)メガネスーパー,眼鏡小売りチェーン大手。直営方式。関東圏地盤に全国展開。投資ファンド支援の下で再建図る
6100,3319,マザーズ,(株)ゴルフダイジェスト・オンライン,記事サイトで集客、ゴルフ場予約、同用品販売で稼ぐ。中古品売買も。同名ゴルフ出版社が出資
6100,3325,マザーズ,ケンコーコム(株),ネットで医薬品、健康食品、日用品を販売。中国でも健康関連品のネット通販を展開。楽天傘下
6100,3326,東証JQS,(株)ランシステム,会員制で差別化の複合カフェ事業が主力化。シニア層開拓も。ゲーム関連商品販売から撤退
6100,3328,マザーズ,(株)ネットプライスドットコム,ネット通販運営。米国ネットオークション「イーベイ」取り次ぎや中古衣類の買い取り販売も
6100,3329,東証JQS,東和フードサービス(株),椿屋をはじめとした高級喫茶、ダッキーダックが主力の外食チェーン。東京圏に直営出店
6100,3331,東証JQS,(株)雑貨屋ブルドッグ,若い女性向けアクセサリー・ファンシー雑貨等専門店。１３年５月株式譲受のアクサス主導で再編
6100,3333,東証1部,(株)あさひ,大規模自転車専門店を直営中心に展開、ネット通販も。ＰＢ比率６割弱、中国、台湾へ生産委託
6100,3341,東証1部,日本調剤(株),調剤２位、関東甲信越の門前薬局が地盤。駅前店や訪問サービス強化。つくばで後発医薬品製造
6100,3344,東証JQS,(株)ワンダーコーポレーション,ゲームソフトやＣＤ等を販売する「ＷｏｎｄｅｒＧＯＯ」を展開。スーパーのカスミグループ
6100,3346,名古屋セ,２１ＬＡＤＹ(株),子会社化した洋菓子「ヒロタ」がグループの中心。輸入雑貨販売「イルムス」を第２の柱に育成
6100,3347,マザーズ,(株)トラスト,レンタカー事業が柱。ネット経由で海外個人向けに中古車輸出も。南アフリカでディーラー展開
6100,3349,東証1部,(株)コスモス薬品,九州地盤のドラッグストア。食い合いおそれず小商圏に大型店多店舗展開。ディスカウント徹底
6100,3352,東証JQS,(株)バッファロー,カー用品のオートバックスＦＣ店を展開。埼玉が地盤。自社商標タイヤや板金塗装を強化中
6100,3353,東証JQS,(株)メディカル一光,三重県地盤の調剤薬局チェーン。介護付き有料老人ホームが第２の柱。中京圏で後発医薬品卸も
6100,3358,東証JQS,ワイエスフード(株),九州地盤で筑豊ラーメン「山小屋」「ばさらか」展開。直営からＦＣ主体に軸足。海外展開積極化
6100,3361,東証2部,(株)トーエル,神奈川県地盤のＬＰガス事業者。高い配送密度が特色。飲料水育成し長野とハワイに生産拠点
6100,3366,東証1部,(株)一六堂,都内中心に居酒屋を展開。主力は高価格帯の「天地旬鮮八吉」。地方漁港のセリ参加権保有が強み
6100,3370,東証JQS,(株)フジタコーポレーション,北海道地盤。ミスタードーナツなどのフランチャイジー。自社業態の丼店、中古書店を強化中
6100,3372,マザーズ,(株)関門海,格安フグ料理「玄品ふぐ」が主力で回転ずしも。冬場に通期利益の大半稼ぐ。経営再建中
6100,3375,東証JQS,(株)ＺＯＡ,バイク用品販売併設のＰＣ販売店を展開し、輸入ＰＢが得意。東海が地盤。ネット通販にも注力
6100,3376,東証JQS,(株)オンリー,「ザ・スーパースーツストア」等ツープライス店軸に自社ブランド紳士服を販売。丸井と業務提携
